{
  "schema_version": 1,
  "gate_id": "G4",
  "input_runs": [],
  "threshold_config": "configs/gates/g4_attenuation.yaml",
  "threshold_status": "TBD-PREREG",
  "primary_metrics": {},
  "safety_metrics": {},
  "participant_statistics": {},
  "status": "blocked",
  "failure_reasons": [
    "The registered threshold config remains TBD-PREREG; thresholds, minimum sample size, and confidence rule are not frozen.",
    "G1, G2, and G3 are blocked and have not approved G4; the population base and P0 real-EEG vertical slice are also blocked.",
    "No immutable participant/session/support/query split or eligible external-mask/eeg-only comparison exists despite targeted readable EEGdenoiseNet and SGEYESUB paths.",
    "SGEYESUB has no verified clean target, EEGdenoiseNet lacks participant/session grouping, Klados native structure remains unreadable, and Eye-BCI is credential-restricted.",
    "CONFLICT-SCI-001 and CONFLICT-SCI-002 remain unresolved, so the attenuation/NULL boundary and gate ordering may not be silently selected.",
    "No learned attenuation, calibration, risk-coverage, abstention, rollback, metric, or participant-level statistic is claimed."
  ],
  "approved_next_stage": null,
  "generated_at_utc": "2026-08-01T12:24:49Z"
}
